url,filepath,filename,title,description,author,category,crawled_at
https://www.elternleben.de/elternwissen/schulkind/gesundheit-und-ernaehrung/,content/elternleben/elternwissen/schulkind/gesundheit-und-ernaehrung.md,gesundheit-und-ernaehrung.md,Dein Schulkind durch die Schulzeit begleiten,"Erfahre, wie du dein Schulkind im Alltag unterstützt. Mit Tipps zu Lernen, Freundschaften und Freizeit.",,"['elternwissen', 'schulkind']",2025-03-05T20:17:51.777426
https://www.elternleben.de/elternwissen-index/elternwissen-index/teenager-familie-und-freizeit/,content/elternleben/elternwissen-index/elternwissen-index/teenager-familie-und-freizeit.md,teenager-familie-und-freizeit.md,Teenager-Familie und Freizeit,,,"['elternwissen-index', 'elternwissen-index']",2025-03-05T20:17:54.473130
https://www.elternleben.de/familie-und-partnerschaft/geschwister/zweites-kind-ja-oder-nein/,content/elternleben/familie-und-partnerschaft/geschwister/zweites-kind-ja-oder-nein.md,zweites-kind-ja-oder-nein.md,Zweites Kind: Ja oder nein?,"Überlegst du, ob und wann du ein zweites Kind bekommen sollst? Unsere Tipps und Gedankenanstöße helfen dir bei der Entscheidung.",,"['familie-und-partnerschaft', 'geschwister']",2025-03-05T20:18:03.164744
https://www.elternleben.de/baby/schreibaby/,content/elternleben/baby/schreibaby.md,schreibaby.md,"Schreibaby verstehen: Ursachen, Symptome und Wege zur Unterstützung",Mein Baby schreit so viel - Schreibaby? Welche Ursachen die Unruhe deines Kindes haben kann und was Eltern tun können - Tipps von Expertin Melanie Schüer.,Melanie Schüer,['baby'],2025-03-05T20:18:05.803137
https://www.elternleben.de/baby/ralf-specht-vater-zu-sein-ist-eine-herausforderung/,content/elternleben/baby/ralf-specht-vater-zu-sein-ist-eine-herausforderung.md,ralf-specht-vater-zu-sein-ist-eine-herausforderung.md,"Ralf Specht: ""Vater zu sein ist eine Herausforderung""","Herausforderung Vatersein: Wie fühlt es sich für Männer an, Vater zu werden? Ralf Specht im Interview zum Thema Vaterwerden",,['baby'],2025-03-05T20:18:07.056167
https://www.elternleben.de/haeufige-fragen/schulkind/,content/elternleben/haeufige-fragen/schulkind.md,schulkind.md,Dein Schulkind durch die Schulzeit begleiten,"Erfahre, wie du dein Schulkind im Alltag unterstützt. Mit Tipps zu Lernen, Freundschaften und Freizeit.",,['haeufige-fragen'],2025-03-05T20:18:13.493803
https://www.elternleben.de/familie-und-partnerschaft/freizeit-urlaub/hannah-loewe-rituale-in-der-weihnachtszeit/,content/elternleben/familie-und-partnerschaft/freizeit-urlaub/hannah-loewe-rituale-in-der-weihnachtszeit.md,hannah-loewe-rituale-in-der-weihnachtszeit.md,Das perfekte Weihnachtsfest?!,"Gibt es das perfekte Weihnachtsfest. Mit einem schönen Tannenbaum, Düfte, Geschenke und lieben Menschen. Eine sehr emotionale Zeit.",Sabine Linz,"['familie-und-partnerschaft', 'freizeit-urlaub']",2025-03-05T20:18:14.336696
https://www.elternleben.de/familie-und-partnerschaft/freizeit-urlaub/kleine-alltags-abenteuer/,content/elternleben/familie-und-partnerschaft/freizeit-urlaub/kleine-alltags-abenteuer.md,kleine-alltags-abenteuer.md,10 kleine Alltags-Abenteuer,Alltag mit kleinen Schulkindern: Raus aus der Routine und rein ins Abenteuer. Zehn kleine Alltagsabenteuer für die ganze Familie. Checkliste für Eltern.,,"['familie-und-partnerschaft', 'freizeit-urlaub']",2025-03-05T20:18:21.201166
https://www.elternleben.de/baby/video-tutorial-erste-zeit-mit-baby-als-eltern-gut-ankommen/,content/elternleben/baby/video-tutorial-erste-zeit-mit-baby-als-eltern-gut-ankommen.md,video-tutorial-erste-zeit-mit-baby-als-eltern-gut-ankommen.md,Video Tutorial: Erste Zeit mit Baby - Als Eltern gut ankommen,Die erste Zeit mit dem Baby – so kommt ihr als Eltern gut an. Wie das Leben einer jungen Familie nach der Geburt aussehen kann. Im Video-Tutorial.,,['baby'],2025-03-05T20:18:22.684374
https://www.elternleben.de/elternwissen/kleinkind/gesundheit-und-ernaehrung/,content/elternleben/elternwissen/kleinkind/gesundheit-und-ernaehrung.md,gesundheit-und-ernaehrung.md,Gesundheit und Ernährung,,,"['elternwissen', 'kleinkind']",2025-03-05T20:18:25.012457
https://www.elternleben.de/schwangerschaft/arbeiten-in-der-schwangerschaft/schwanger-am-arbeitsplatz-worauf-es-ankommt/,content/elternleben/schwangerschaft/arbeiten-in-der-schwangerschaft/schwanger-am-arbeitsplatz-worauf-es-ankommt.md,schwanger-am-arbeitsplatz-worauf-es-ankommt.md,"Schwanger am Arbeitsplatz - Worauf es ankommt: Timing, Transparenz, Teamwork","Schwanger am Arbeitsplatz: Uwe Vollmer im Interview über Schwangere im Beruf und wie sie mit Elternzeit, Wiedereinstieg und Job umgehen sollten.",,"['schwangerschaft', 'arbeiten-in-der-schwangerschaft']",2025-03-05T20:18:31.547369
https://www.elternleben.de/baby/entwicklung-baby/7-9-monate/,content/elternleben/baby/entwicklung-baby/7-9-monate.md,7-9-monate.md,So entwickelt sich dein Baby mit 7 bis 9 Monaten,"Dein Baby ist mit 7 bis 9 Monaten sehr aktiv und möchte alles in seiner kleinen-großen Welt entdecken. Erfahre hier, wie du es in seiner Entwicklung unterstützen kannst.",,"['baby', 'entwicklung-baby']",2025-03-05T20:18:36.869472
https://www.elternleben.de/kleinkind/kita/mein-kind-will-nicht-in-den-kindergarten-gehen/,content/elternleben/kleinkind/kita/mein-kind-will-nicht-in-den-kindergarten-gehen.md,mein-kind-will-nicht-in-den-kindergarten-gehen.md,Mein Kind will nicht in den Kindergarten: Was kann ich tun?,"Dein Kind möchte nicht in den Kindergarten? Hol dir Tipps, wie du es sanft auf den Kita-Alltag vorbereiten und ihm den Start erleichtern kannst.",Dr. Martina Stotz,"['kleinkind', 'kita']",2025-03-05T20:18:37.337968
https://www.elternleben.de/kleinkind/streit-auf-dem-spielplatz/,content/elternleben/kleinkind/streit-auf-dem-spielplatz.md,streit-auf-dem-spielplatz.md,Streit auf dem Spielplatz,"Ärger, Streit, Konflikte – Kinder auf dem Spielplatz. Wann muss ich als Mutter/ Vater eingreifen? Und warum streiten sich Kleinkinder? Infos bei ElternLeben.",Sandra Lößl,['kleinkind'],2025-03-05T20:18:40.647886
https://www.elternleben.de/erziehung-und-foerderung/erziehungsstile/das-innere-kind-einfluss-auf-deine-elternschaft/,content/elternleben/erziehung-und-foerderung/erziehungsstile/das-innere-kind-einfluss-auf-deine-elternschaft.md,das-innere-kind-einfluss-auf-deine-elternschaft.md,Das Innere Kind: Einfluss auf Eltern,Was ist das Innere Kind? Und welchen Einfluss hat das Innere Kind auf Mütter & Väter? Wie Eltern mit dem eigenen Inneren Kind umgehen können.,Melanie Schüer,"['erziehung-und-foerderung', 'erziehungsstile']",2025-03-05T20:18:43.484795
https://www.elternleben.de/baby/bindung/warum-dein-baby-deine-naehe-braucht/,content/elternleben/baby/bindung/warum-dein-baby-deine-naehe-braucht.md,warum-dein-baby-deine-naehe-braucht.md,Warum dein Baby deine Nähe braucht,"Du bist so müde, dass du im Sitzen einschlafen kannst, aber dein Baby ist immer noch wach. Sobald du es ablegen möchtest, protestiert es.",Melanie Schüer,"['baby', 'bindung']",2025-03-05T20:18:45.543354
https://www.elternleben.de/elternwissen-index/elternwissen-index/schulkind-erziehung-und-bildung/,content/elternleben/elternwissen-index/elternwissen-index/schulkind-erziehung-und-bildung.md,schulkind-erziehung-und-bildung.md,Schulkind-Erziehung und Bildung,,,"['elternwissen-index', 'elternwissen-index']",2025-03-05T20:18:47.734367
https://www.elternleben.de/haeufige-fragen/schwangerschaft/,content/elternleben/haeufige-fragen/schwangerschaft.md,schwangerschaft.md,Schwangerschaft,,,['haeufige-fragen'],2025-03-05T20:18:47.886907
https://www.elternleben.de/erziehung-und-foerderung/sprachentwicklung-von-kindern/sprachentwicklung-foerdern/,content/elternleben/erziehung-und-foerderung/sprachentwicklung-von-kindern/sprachentwicklung-foerdern.md,sprachentwicklung-foerdern.md,Sprachentwicklung fördern: Tipps für Eltern,"Erfahre, wie du die Sprachentwicklung deines Kindes spielerisch fördern kannst. Praktische Tipps und Übungen für deinen Alltag!",,"['erziehung-und-foerderung', 'sprachentwicklung-von-kindern']",2025-03-05T20:18:49.788365
https://www.elternleben.de/baby/babynahrung/essen-mit-loeffel/,content/elternleben/baby/babynahrung/essen-mit-loeffel.md,essen-mit-loeffel.md,Essen mit Löffel lernen: Praktische Tipps,"Essen mit Löffel zu lernen ist ein wichtiger Meilenstein für Babys und Kleinkinder. Erfahre, wie du dein Kind dabei unterstützen kannst.",,"['baby', 'babynahrung']",2025-03-05T20:19:00.957268
https://www.elternleben.de/schwangerschaft/bald-zu-dritt/,content/elternleben/schwangerschaft/bald-zu-dritt.md,bald-zu-dritt.md,Bald sind wir zu dritt - Ein gemeinsamer Blick nach vorne,"Die Geburt des Babys naht – bald sind wir zu dritt! Diese Fragen helfen Dir und Deinem Partner bei der Planung von Familie, Alltag und Partnerschaft.",,['schwangerschaft'],2025-03-05T20:19:02.732213
https://www.elternleben.de/elternwissen/gesundheit-und-ernaehrung/,content/elternleben/elternwissen/gesundheit-und-ernaehrung.md,gesundheit-und-ernaehrung.md,Gesundheit und Ernährung für Familien stärken,"Möchtest du die Gesundheit deiner Familie stärken? Unsere Expertentipps zeigen dir effektive Wege, um Wohlbefinden und Gesundheit im Familienalltag zu fördern.",,['elternwissen'],2025-03-05T20:19:04.110802
https://www.elternleben.de/familie-und-partnerschaft/beruf/familie-und-beruf-vaeter-wuenschen-sich-vereinbarkeit/,content/elternleben/familie-und-partnerschaft/beruf/familie-und-beruf-vaeter-wuenschen-sich-vereinbarkeit.md,familie-und-beruf-vaeter-wuenschen-sich-vereinbarkeit.md,Familie und Beruf – Väter wünschen sich Vereinbarkeit,"Vor welchen Fragen stehen Väter, die sich eine bessere Vereinbarung von Beruf und Familie wünschen?",,"['familie-und-partnerschaft', 'beruf']",2025-03-05T20:19:05.459514
https://www.elternleben.de/baby/gesundes-baby/,content/elternleben/baby/gesundes-baby.md,gesundes-baby.md,Gesundes Baby - Wissenswertes über die Babygesundheit auf einen Blick,"Erfahre, wie du die Gesundheit deines Babys stärken und seine optimale Entwicklung fördern kannst.",,['baby'],2025-03-05T20:19:06.290286
https://www.elternleben.de/elternwissen-index/elternwissen-index/kita-kind-entwicklung-und-foerderung/,content/elternleben/elternwissen-index/elternwissen-index/kita-kind-entwicklung-und-foerderung.md,kita-kind-entwicklung-und-foerderung.md,KiTa-Kind-Entwicklung und Foerderung,,,"['elternwissen-index', 'elternwissen-index']",2025-03-05T20:19:08.421133
https://www.elternleben.de/shop/babyschlaf-handbook-e/,content/elternleben/shop/babyschlaf-handbook-e.md,babyschlaf-handbook-e.md,"Babyschlaf-Handbuch – Tipps, wissen und Schlafmethoden","Dein Baby wacht nachts häufig auf oder schläft nur auf dem Arm ein? Im Handbuch findest du Tipps, Wissen und Schlafmethoden, die deinem Baby helfen, besseren Schlaf zu finden",,['shop'],2025-03-05T20:19:10.565950
https://www.elternleben.de/kleinkind/entwicklung-foerderung/trennungsschmerzen-bei-kindern/,content/elternleben/kleinkind/entwicklung-foerderung/trennungsschmerzen-bei-kindern.md,trennungsschmerzen-bei-kindern.md,Trennungsschmerzen bei Kindern – Dr. Martina Stotz,"Kinder haben oft Trennungsängste. Im Video erklärt Dr. Martina Stotz Waldmann, wie Du Dein Kind hier gut begleiten kannst.",,"['kleinkind', 'entwicklung-foerderung']",2025-03-05T20:19:10.730467
https://www.elternleben.de/gesundheit-ernaehrung/hausapotheke-fuer-babys-und-kinder/,content/elternleben/gesundheit-ernaehrung/hausapotheke-fuer-babys-und-kinder.md,hausapotheke-fuer-babys-und-kinder.md,Hausapotheke für Babys und Kinder,"Was gehört in die Hausapotheke für Kinder? Finde heraus, welche Medikamente und Hilfsmittel du für den Notfall parat haben solltest.",Dr. Nikola Klün,['gesundheit-ernaehrung'],2025-03-05T20:19:12.779641
https://www.elternleben.de/shop/video-seminar-wutausbrueche-begleiten/,content/elternleben/shop/video-seminar-wutausbrueche-begleiten.md,video-seminar-wutausbrueche-begleiten.md,Video-Seminar Wutausbrüche begleiten,"Wie Mütter und Väter Wutausbrüche ihres Kindes begleiten und mit ihrer eigenen Wut und der ihres Kindes umgehen können, lernst du in diesem Video-Seminar mit Dr. Martina Stotz.",,['shop'],2025-03-05T20:19:18.456371
https://www.elternleben.de/baby/babypflege/baby-laesst-sich-nicht-wickeln/,content/elternleben/baby/babypflege/baby-laesst-sich-nicht-wickeln.md,baby-laesst-sich-nicht-wickeln.md,Mein Baby lässt sich nicht mehr wickeln - Was kann ich tun?,"Dein Baby strampelt oder weint beim Wickeln? Erfahre, warum das passiert & wie du dein Kind liebevoll beruhigst. Jetzt Tipps lesen!",,"['baby', 'babypflege']",2025-03-05T20:19:18.636103
https://www.elternleben.de/baby/babyschlaf/hannah-loewe-schlaft-schoen-teil-2-einschlaf-tipps-fuer-babys/,content/elternleben/baby/babyschlaf/hannah-loewe-schlaft-schoen-teil-2-einschlaf-tipps-fuer-babys.md,hannah-loewe-schlaft-schoen-teil-2-einschlaf-tipps-fuer-babys.md,Hannah Löwe: Schlaft schön - Teil 2 | Einschlaf-Tipps für Babys,Einschlafprobleme bei Babys: Wie ihr als Eltern das Einschlafen für euer Baby fördert: Tipps von Hannah Löwe im Video-Blog auf ElternLeben.de,,"['baby', 'babyschlaf']",2025-03-05T20:19:19.418330
https://www.elternleben.de/erziehung-und-foerderung/mehr-geduld-mit-kindern/,content/elternleben/erziehung-und-foerderung/mehr-geduld-mit-kindern.md,mehr-geduld-mit-kindern.md,"Hannah Löwe: Geduld, Ungeduld und Matz!","Kinder brauchen Aufmerksamkeit, Liebe und Geduld – Im stressigen Alltag kann das Eltern vor eine Herausforderung stellen. Hannah Löwe im Video-Blog",,['erziehung-und-foerderung'],2025-03-05T20:19:28.544428
https://www.elternleben.de/baby/babynahrung/,content/elternleben/baby/babynahrung.md,babynahrung.md,Gesunde Babynahrung - Expertentipps fürs erste Lebensjahr,"Entdecke in unserem umfassenden Leitfaden Expertenratschläge zur Ernährung deines Babys im ersten Lebensjahr, um eine gesunde Entwicklung zu fördern.",,['baby'],2025-03-05T20:19:28.701979
https://www.elternleben.de/erziehung-und-foerderung/,content/elternleben/erziehung-und-foerderung.md,erziehung-und-foerderung.md,Erziehung und Förderung von Kindern: Tipps für liebevolle Eltern,"Wertvolle Tipps zur Kindererziehung: Erfahre von unseren Expert*innen, wie du die Entwicklung deines Kindes liebevoll begleiten und Fähigkeiten fördern kannst.",,elternleben,2025-03-05T20:19:30.067206
https://www.elternleben.de/l/schlafberatung/,content/elternleben/l/schlafberatung.md,schlafberatung.md,Schlafberatung für Babys und Kinder - ElternLeben.de,"Dein Baby schläft nur auf dem Arm ein oder schläft unruhig? Dein Kind will abends nicht alleine einschlafen? Die Schlafberatung kann dir helfen, stell uns deine Frage!",,['l'],2025-03-05T20:19:33.025114
https://www.elternleben.de/teenager/hochbegabung-bei-teenagern/,content/elternleben/teenager/hochbegabung-bei-teenagern.md,hochbegabung-bei-teenagern.md,Hochbegabung bei Teenagern – mehr Probleme in der Pubertät?,Bei Eltern hochbegabter Kinder im Grundschulalter wird bei Planungen von schulischen Maßnahmen oft die Pubertät als großes Problem in den Raum gestellt.,Martina Rosenboom,['teenager'],2025-03-05T20:19:33.212400
https://www.elternleben.de/erziehung-und-foerderung/medienkonsum-bei-kindern/digital-detox-medienpausen/,content/elternleben/erziehung-und-foerderung/medienkonsum-bei-kindern/digital-detox-medienpausen.md,digital-detox-medienpausen.md,Digital Detox für Kinder: Tipps für gesunde Medienpausen,Reduziere Stress mit Digital Detox: Entspannende Tipps für gesunde Medienpausen bei Kindern.,Svenja Gleffe,"['erziehung-und-foerderung', 'medienkonsum-bei-kindern']",2025-03-05T20:19:36.983818
https://www.elternleben.de/l/beratung-hochbegabung/,content/elternleben/l/beratung-hochbegabung.md,beratung-hochbegabung.md,Beratung Hochbegabung bei Kindern,"Du vermutest, dass dein Kind hochbegabt ist? Es zeigt in manchen Bereichen überdurchschnittlich gutes Verständnis und eine sehr schnelle Lernentwicklung? Wir unterstützen dich auf diesem Weg mit persönlicher Beratung.",,['l'],2025-03-05T20:19:50.658194
https://www.elternleben.de/teenager/empty-nest-syndrom/,content/elternleben/teenager/empty-nest-syndrom.md,empty-nest-syndrom.md,"Empty Nest Syndrom: Symptome, Hintergründe & Tipps","Das Empty Nest Syndrom: Die wichtigsten Infos zu Symptomen, Hintergrund und Tipps zum  Umgang mit dem Empty Nest Syndrom.",Melanie Schüer,['teenager'],2025-03-05T20:19:51.389514
https://www.elternleben.de/l/hebamme-online/,content/elternleben/l/hebamme-online.md,hebamme-online.md,Hebammen online auf Elternleben.de,Hebammen online: hast du eine Frage an einer Hebamme? Du bist schwanger und brauchst Rat? Unsere Hebammen sind für dich da!,,['l'],2025-03-05T20:19:51.550233
https://www.elternleben.de/shop/glueckliche-beziehung/,content/elternleben/shop/glueckliche-beziehung.md,glueckliche-beziehung.md,Glückliche Beziehung & Partnerschaft: Dein Handbuch,"Was Eltern tun können, um ihre Partnerschaft zu pflegen und die Basis für eine glückliche Beziehung schaffen zu können.",,['shop'],2025-03-05T20:20:01.753585
https://www.elternleben.de/schulkind/vorpubertaet/,content/elternleben/schulkind/vorpubertaet.md,vorpubertaet.md,Alles plötzlich anders? Kinder in der Vorpubertät,Kinder in der Vorpubertät - schwierige Phase für Eltern und Kind. Wie Mutter und Vater mit dem neuen Alltag umgehen können. Tipps für Familien,,['schulkind'],2025-03-05T20:20:03.276592
https://www.elternleben.de/familie-und-partnerschaft/paarbeziehung/richtig-streiten/,content/elternleben/familie-und-partnerschaft/paarbeziehung/richtig-streiten.md,richtig-streiten.md,Richtig streiten in der Beziehung – Die besten Tipps,Wie funktioniert richtig streiten in der Partnerschaft? Konflikte bleiben im Familienleben nicht aus. Dies könnt ihr beim nächsten Streit beachten.,,"['familie-und-partnerschaft', 'paarbeziehung']",2025-03-05T20:20:04.804706
https://www.elternleben.de/familie-und-partnerschaft/freizeit-urlaub/packliste-fuer-den-familienurlaub/,content/elternleben/familie-und-partnerschaft/freizeit-urlaub/packliste-fuer-den-familienurlaub.md,packliste-fuer-den-familienurlaub.md,Packliste für den Familienurlaub: Alles im Blick,"Familienurlaub leicht gemacht: Nutze unsere praktische Packliste, um stressfrei zu packen und gut organisiert in die Ferien zu starten.",,"['familie-und-partnerschaft', 'freizeit-urlaub']",2025-03-05T20:20:07.268601
https://www.elternleben.de/haeufige-fragen/hochbegabung-hochsensibilitaet/,content/elternleben/haeufige-fragen/hochbegabung-hochsensibilitaet.md,hochbegabung-hochsensibilitaet.md,Hochbegabung bei Kindern verstehen und fördern,"Erkenne die Zeichen von Hochbegabung bei deinem Kind und erfahre, wie du es optimal unterstützen kannst. Wichtige Tipps und Infos für Eltern!",,['haeufige-fragen'],2025-03-05T20:20:12.803762
https://www.elternleben.de/elternwissen/kleinkind/partnerschaft-und-elternrolle/,content/elternleben/elternwissen/kleinkind/partnerschaft-und-elternrolle.md,partnerschaft-und-elternrolle.md,Partnerschaft und Elternrolle,,,"['elternwissen', 'kleinkind']",2025-03-05T20:20:18.696779
https://www.elternleben.de/baby/entwicklung-baby/baby-tragen/,content/elternleben/baby/entwicklung-baby/baby-tragen.md,baby-tragen.md,Baby tragen leicht gemacht,"Alles, was du über das Baby tragen wissen musst: Vorteile, Trageberatung und praktische Tipps für die Auswahl der idealen Tragehilfe.",Frauke Ludwig,"['baby', 'entwicklung-baby']",2025-03-05T20:20:19.659544
https://www.elternleben.de/familie-und-partnerschaft/trennung-mit-kindern/wenn-eltern-sich-trennen-gefuehle-zulassen-ist-wichtig/,content/elternleben/familie-und-partnerschaft/trennung-mit-kindern/wenn-eltern-sich-trennen-gefuehle-zulassen-ist-wichtig.md,wenn-eltern-sich-trennen-gefuehle-zulassen-ist-wichtig.md,Trennung und Gefühle: So gehst du achtsam mit deinen Emotionen um,"Gefühle bei einer Trennung zu unterdrücken hilft nicht. Hier findest du Wege, deine Emotionen anzunehmen und sie im Alltag besser zu verarbeiten.",Vanessa Matthiebe,"['familie-und-partnerschaft', 'trennung-mit-kindern']",2025-03-05T20:20:23.539103
https://www.elternleben.de/familie-und-partnerschaft/haushalt-und-familienalltag/ab-wann-darf-ein-kind-allein-zu-hause-bleiben/,content/elternleben/familie-und-partnerschaft/haushalt-und-familienalltag/ab-wann-darf-ein-kind-allein-zu-hause-bleiben.md,ab-wann-darf-ein-kind-allein-zu-hause-bleiben.md,Ab wann darf ein Kind allein zu Hause bleiben?,"Kinder allein zu Hause? Wann und wie lange dürfen Eltern ihr Baby, Kleinkind oder Schulkind allein lassen? Tipps findet Ihr hier",,"['familie-und-partnerschaft', 'haushalt-und-familienalltag']",2025-03-05T20:20:25.371870
https://www.elternleben.de/kleinkind/entwicklung-foerderung/kind-troedelt/,content/elternleben/kleinkind/entwicklung-foerderung/kind-troedelt.md,kind-troedelt.md,Dein Kind trödelt? Warum Kleinkinder sich ungern beeilen und ihr eigenes Tempo brauchen,"Wir planen, organisieren, arbeiten, und hetzen von Termin zu Termin. Ganz normal in einem Erwachsenenleben. Und dann werden wir Eltern.",Sandra Lößl,"['kleinkind', 'entwicklung-foerderung']",2025-03-05T20:20:33.596082
https://www.elternleben.de/elternwissen/kleinkind/familie-und-freizeit/,content/elternleben/elternwissen/kleinkind/familie-und-freizeit.md,familie-und-freizeit.md,Familie und Freizeit,,,"['elternwissen', 'kleinkind']",2025-03-05T20:20:36.571090
https://www.elternleben.de/familie-und-partnerschaft/paarbeziehung/humor-und-lachen-in-der-partnerschaft/,content/elternleben/familie-und-partnerschaft/paarbeziehung/humor-und-lachen-in-der-partnerschaft.md,humor-und-lachen-in-der-partnerschaft.md,Humor und Lachen in der Partnerschaft,"Humor lässt uns auf eine bestimmte Weise das Leben betrachten. Kann man sich in jemanden verlieben, obwohl der Humor ganz unterschiedlich ist?",Sabine Linz,"['familie-und-partnerschaft', 'paarbeziehung']",2025-03-05T20:20:39.220829
https://www.elternleben.de/erziehung-und-foerderung/neurodiversitaet-bei-kindern/umgang-mit-adhs-bei-kindern/,content/elternleben/erziehung-und-foerderung/neurodiversitaet-bei-kindern/umgang-mit-adhs-bei-kindern.md,umgang-mit-adhs-bei-kindern.md,Umgang mit ADHS-Kindern – Tipps für Eltern,"Mit ADHS umgehen: Tipps für klare Regeln, Verständnis und eine liebevolle Begleitung deines Kindes im Alltag.",Melanie Schüer,"['erziehung-und-foerderung', 'neurodiversitaet-bei-kindern']",2025-03-05T20:20:46.008368
https://www.elternleben.de/baby/entwicklung-baby/sexuelle-entwicklung-bei-babys/,content/elternleben/baby/entwicklung-baby/sexuelle-entwicklung-bei-babys.md,sexuelle-entwicklung-bei-babys.md,Sexuelle Entwicklung bei Babys,Sexualität: Wie und wann findet die sexuelle Entwicklung bei Babys statt? Wie gehen Eltern damit um? Eine Übersicht findest du hier.,Melanie Schüer,"['baby', 'entwicklung-baby']",2025-03-05T20:20:49.391266
https://www.elternleben.de/kleinkind/entwicklung-foerderung/der-erste-haarschnitt/,content/elternleben/kleinkind/entwicklung-foerderung/der-erste-haarschnitt.md,der-erste-haarschnitt.md,Der erste Haarschnitt,Kleinkindern die Haare schneiden: Friseur oder können Mutter und Vater selbst zur Schere greifen? Alles zum Thema Haarschnitt im Artikel,,"['kleinkind', 'entwicklung-foerderung']",2025-03-05T20:20:51.474386
https://www.elternleben.de/erziehung-und-foerderung/mehrsprachigkeit-bei-kindern/fremdsprache-erlernen/,content/elternleben/erziehung-und-foerderung/mehrsprachigkeit-bei-kindern/fremdsprache-erlernen.md,fremdsprache-erlernen.md,Fremdsprache Erlernen – schon als Kleinkind anfangen?,Als Kleinkind schon Englisch oder eine andere Fremdsprache erlernen? Bilinguale Erziehung früh anfangen. Familien haben individuelle Lebensentwürfe.,Helen Mensen,"['erziehung-und-foerderung', 'mehrsprachigkeit-bei-kindern']",2025-03-05T20:20:55.602007
https://www.elternleben.de/erziehung-und-foerderung/neurodiversitaet-bei-kindern/adhs/,content/elternleben/erziehung-und-foerderung/neurodiversitaet-bei-kindern/adhs.md,adhs.md,Hat mein Kind ADS / ADHS? Symptome und was du tun solltest,"Du glaubst, dein Kind hat ADS / ADHS? Die Kinder- & Jugendlichenpsychotherapeutin erklärt dir, was bei ADS & ADHS Verdacht zu tun ist.",Melanie Schüer,"['erziehung-und-foerderung', 'neurodiversitaet-bei-kindern']",2025-03-05T20:20:59.089910
https://www.elternleben.de/erziehung-und-foerderung/wie-kann-ich-mein-kind-foerdern/,content/elternleben/erziehung-und-foerderung/wie-kann-ich-mein-kind-foerdern.md,wie-kann-ich-mein-kind-foerdern.md,Optimale Förderung für mein Kind – von Anfang an!,"Wie kann ich mein Kind optimal fördern?
Viele Eltern kaufen hochwertige Lern- und Förderspiele, gehen zur Babymassage, Babyschwimmen, zum Kinderturnen.",Nadine Büttner,['erziehung-und-foerderung'],2025-03-05T20:21:00.698651
https://www.elternleben.de/familie-und-partnerschaft/haushalt-und-familienalltag/heinzelmaennchen-fuer-gestresste-eltern/,content/elternleben/familie-und-partnerschaft/haushalt-und-familienalltag/heinzelmaennchen-fuer-gestresste-eltern.md,heinzelmaennchen-fuer-gestresste-eltern.md,Heinzelmännchen für gestresste Eltern,"Muss ich alles selber machen? Fehlende Netzwerke und Doppelbelastung von Beruf und Familie – Tipps, welche Unterstützungsmöglichkeiten es für euch gibt.",,"['familie-und-partnerschaft', 'haushalt-und-familienalltag']",2025-03-05T20:21:02.519442
https://www.elternleben.de/shop/haushalt-in-der-familie-organisieren/,content/elternleben/shop/haushalt-in-der-familie-organisieren.md,haushalt-in-der-familie-organisieren.md,Haushalt in der Familie organisieren,"Eines haben alle Haushalte gemeinsam: es gibt Aufgaben, die irgendwann erledigt werden müssen. Hier Tipps, wie Kinder gut in Abläufe eingebunden werden können.",,['shop'],2025-03-05T20:21:02.985684
