url,filepath,filename,title,description,author,category,crawled_at
https://www.elternleben.de/newsletter-abonnieren/,content/elternleben/newsletter-abonnieren.md,newsletter-abonnieren.md,Newsletter abonnieren,,,elternleben,2025-03-05T19:52:29.470040
https://www.elternleben.de/familie-und-partnerschaft/trennung-mit-kindern/trennung-erklaeren/,content/elternleben/familie-und-partnerschaft/trennung-mit-kindern/trennung-erklaeren.md,trennung-erklaeren.md,Trennung erklären: So sprichst du mit deinen Kindern,"Trennung? Finde heraus, wie du deinen Kindern die Trennung ehrlich und einfühlsam erklären kannst.",Vanessa Matthiebe,"['familie-und-partnerschaft', 'trennung-mit-kindern']",2025-03-05T19:52:55.204355
https://www.elternleben.de/baby/taufe/,content/elternleben/baby/taufe.md,taufe.md,Ein besonderes Ritual: Die Taufe,"Ihr wollt Euer Kind taufen lassen? Findet hier Tipps rund um Taufkleid, Taufkerze und Tauffeier, die Euch beim Planen des großen Ereignisses helfen sollen.",Rose Volz-Schmidt,['baby'],2025-03-05T19:52:55.370216
https://www.elternleben.de/elternwissen-index/elternwissen-index/kleinkind-gesundheit-und-ernaehrung/,content/elternleben/elternwissen-index/elternwissen-index/kleinkind-gesundheit-und-ernaehrung.md,kleinkind-gesundheit-und-ernaehrung.md,Kleinkind-Gesundheit und Ernaehrung,,,"['elternwissen-index', 'elternwissen-index']",2025-03-05T19:52:55.523655
https://www.elternleben.de/baby/babyschlaf/baby-laesst-sich-nicht-ablegen/,content/elternleben/baby/babyschlaf/baby-laesst-sich-nicht-ablegen.md,baby-laesst-sich-nicht-ablegen.md,Baby lässt sich nicht ablegen,Dein Baby lässt sich nicht mehr ablegen? Es wacht beim Ablegen auf und weint? Unsere Expertin gibt dir 4 Tipps damit das Ablegen klappt.,Melanie Schüer,"['baby', 'babyschlaf']",2025-03-05T19:52:56.606262
https://www.elternleben.de/schulkind/hobbys-fuer-kinder/,content/elternleben/schulkind/hobbys-fuer-kinder.md,hobbys-fuer-kinder.md,Das richtige Hobby finden,"Hat dein Kind schon mit einem konkreten Wunsch? Das macht es leichter. Es kann aber auch sein, dass es von sich aus keine Initiative ergreift oder keine Idee hat. Lass deinem Kind die Zeit, die es braucht.",Malena Böse,['schulkind'],2025-03-05T19:52:57.090758
https://www.elternleben.de/erziehung-und-foerderung/langeweile-bei-kindern/,content/elternleben/erziehung-und-foerderung/langeweile-bei-kindern.md,langeweile-bei-kindern.md,Langeweile bei Kindern - warum sie so wichtig ist,Langeweile bei Schulkindern: Warum sie gut zur Förderung der Kreativität eines Kindes ist und nicht durch Medien überbrückt werden sollte. Tipps für Eltern,,['erziehung-und-foerderung'],2025-03-05T19:53:01.262582
https://www.elternleben.de/familie-und-partnerschaft/beruf/zurueck-im-job-ein-erfahrungsbericht/,content/elternleben/familie-und-partnerschaft/beruf/zurueck-im-job-ein-erfahrungsbericht.md,zurueck-im-job-ein-erfahrungsbericht.md,Zurück im Job - Ein Erfahrungsbericht,"Mutterschutz und Elternzeit gehen zuende, die Rückkehr in den Job naht - Katrin Gensheimer über ihre Erfahrungen bei dem Wiedereinstieg in den Beruf.",,"['familie-und-partnerschaft', 'beruf']",2025-03-05T19:53:02.545554
https://www.elternleben.de/schwangerschaft/gesunde-schwangerschaft/schlafen/,content/elternleben/schwangerschaft/gesunde-schwangerschaft/schlafen.md,schlafen.md,Schlafen in der Schwangerschaft: Tipps für erholsame Nächte,Trotz Müdigkeit – wenig Schlaf in der Schwangerschaft. Wie Mütter mit Babybauch richtig schlafen und vor der Geburt ihres Babys genug Ruhe finden.,,"['schwangerschaft', 'gesunde-schwangerschaft']",2025-03-05T19:53:03.538677
https://www.elternleben.de/erziehung-und-foerderung/grenzen-setzen/,content/elternleben/erziehung-und-foerderung/grenzen-setzen.md,grenzen-setzen.md,Gewaltfrei Grenzen zeigen – Dr. Martina Stotz,"In fünf Schritten zeigt dir Dr. Martina Stotz in diesem Impuls-Video, wie du deinem Kind gewaltfrei deine innere Grenze zeigen kannst.",,['erziehung-und-foerderung'],2025-03-05T19:53:07.690136
https://www.elternleben.de/elternwissen/kita-kind/partnerschaft-und-elternrolle/,content/elternleben/elternwissen/kita-kind/partnerschaft-und-elternrolle.md,partnerschaft-und-elternrolle.md,Partnerschaft und Elternrolle,,,"['elternwissen', 'kita-kind']",2025-03-05T19:53:10.928949
https://www.elternleben.de/shop/video-seminar-sichere-bindung/,content/elternleben/shop/video-seminar-sichere-bindung.md,video-seminar-sichere-bindung.md,Video-Seminar Sichere Bindung,"Das erste und zweite Lebensjahr ist entscheidend für den Aufbau einer sicheren Bindung  zu deinem Kind. Erfahre in diesem Video-Seminar mit Dr. Martina Stotz, wie das funktioniert.",,['shop'],2025-03-05T19:53:17.641409
https://www.elternleben.de/shop/spiele-spielen-mit-kindern/,content/elternleben/shop/spiele-spielen-mit-kindern.md,spiele-spielen-mit-kindern.md,Spiele spielen mit Kindern,"Spielend erwirbt ein Kind zentrale Kompetenzen wie Selbstvertrauen, Kreativität, Kommunikation, Empathie, Konfliktfähigkeit und den Umgang mit Misserfolgen.",,['shop'],2025-03-05T19:53:17.879653
https://www.elternleben.de/baby/tipps-fuer-die-partnerschaft-von-babyeltern/,content/elternleben/baby/tipps-fuer-die-partnerschaft-von-babyeltern.md,tipps-fuer-die-partnerschaft-von-babyeltern.md,Eltern werden und Paar bleiben: So gelingt eure Beziehung,"So bleibt eure Partnerschaft lebendig und stark, auch mit Baby. Wertvolle Anregungen für frischgebackene Eltern.",Melanie Schüer,['baby'],2025-03-05T19:53:18.660486
https://www.elternleben.de/familie-und-partnerschaft/stress-und-konflikte-mit-der-schwiegermutter/,content/elternleben/familie-und-partnerschaft/stress-und-konflikte-mit-der-schwiegermutter.md,stress-und-konflikte-mit-der-schwiegermutter.md,Stress und Konflikte mit der Schwiegermutter?,"Stress und Streit kann zum Ende der Beziehung führen. Alle leiden darunter, besonders die Kinder.",,['familie-und-partnerschaft'],2025-03-05T19:53:23.470939
https://www.elternleben.de/schulkind/sicherer-schulweg/,content/elternleben/schulkind/sicherer-schulweg.md,sicherer-schulweg.md,Der sichere Schulweg,"Der Schulweg - wie kommt mein Kind zur Schule? Fahrrad,  öffentliche Verkehrsmittel, Auto oder doch zu Fuß?  Tipps, wie ihr den sichersten Schulweg findet.",,['schulkind'],2025-03-05T19:53:24.460836
https://www.elternleben.de/kleinkind/trocken-werden/toepfchen-oder-toilettenaufsatz-was-ist-besser/,content/elternleben/kleinkind/trocken-werden/toepfchen-oder-toilettenaufsatz-was-ist-besser.md,toepfchen-oder-toilettenaufsatz-was-ist-besser.md,Töpfchen oder Toilettenaufsatz – Was ist besser?,"Töpfchen oder Toilettenaufsatz? Finde heraus, welche Option für dein Kind beim Trockenwerden am besten geeignet ist.",Sandra Lößl,"['kleinkind', 'trocken-werden']",2025-03-05T19:53:26.051298
https://www.elternleben.de/gesundheit-ernaehrung/entspannung-stressbewaeltigung/resilienz-bei-kindern/,content/elternleben/gesundheit-ernaehrung/entspannung-stressbewaeltigung/resilienz-bei-kindern.md,resilienz-bei-kindern.md,Resilienz bei Kindern fördern – Die 7 besten Tipps,"Resilienz bei Kindern fördern: 7 alltagstaugliche Tipps, die Kinder stark machen. Mehr Widerstandsfähigkeit trotz schwieriger Umstände. Hier lesen!",,"['gesundheit-ernaehrung', 'entspannung-stressbewaeltigung']",2025-03-05T19:53:30.662744
https://www.elternleben.de/baby/babyausstattung/schnuller/,content/elternleben/baby/babyausstattung/schnuller.md,schnuller.md,Schnuller für mein Baby - Ja oder Nein?,"Schnuller für mein Baby - Ja oder Nein? Eine Frage, die viele Eltern sich stellen. Wir bieten ein Pro und Contra für Unentschlossene.",,"['baby', 'babyausstattung']",2025-03-05T19:53:32.243215
https://www.elternleben.de/schulkind/herausforderungen-in-der-schule/mobbing/,content/elternleben/schulkind/herausforderungen-in-der-schule/mobbing.md,mobbing.md,Mobbing in der Schule – was Eltern tun können,"Wenn Mobbing in der Schule dein Kind betrifft - Lese hier, wie du mit der Situation umgehst und dein Kind unterstützt.",Malena Böse,"['schulkind', 'herausforderungen-in-der-schule']",2025-03-05T19:53:38.937207
https://www.elternleben.de/erziehung-und-foerderung/neurodiversitaet-bei-kindern/selektiver-mutismus-schuechternheit-autismus-unterschiede/,content/elternleben/erziehung-und-foerderung/neurodiversitaet-bei-kindern/selektiver-mutismus-schuechternheit-autismus-unterschiede.md,selektiver-mutismus-schuechternheit-autismus-unterschiede.md,Selektiver Mutismus: Was Eltern wissen sollten,"Selektiver Mutismus bei Kindern: Zahlen, Ursachen und Unterscheidungen zu Autismus & Schüchternheit. Unsere Expertin erklärt.",,"['erziehung-und-foerderung', 'neurodiversitaet-bei-kindern']",2025-03-05T19:53:40.601852
https://www.elternleben.de/schulkind/elterngespraech-in-der-schule/,content/elternleben/schulkind/elterngespraech-in-der-schule.md,elterngespraech-in-der-schule.md,Elterngespräch in der Schule – so kannst du dich vorbereiten,"Lehrkräfte lernen in ihrer Ausbildung, ein gutes Elterngespräch zu führen. Du kannst als Mutter oder Vater viel dazu beitragen, gemeinsam einen Schritt weiterzukommen.",Martina Rosenboom,['schulkind'],2025-03-05T19:53:41.339175
https://www.elternleben.de/familie-und-partnerschaft/freizeit-urlaub/hannah-loewe-geschenkpapier-selbstgemacht/,content/elternleben/familie-und-partnerschaft/freizeit-urlaub/hannah-loewe-geschenkpapier-selbstgemacht.md,hannah-loewe-geschenkpapier-selbstgemacht.md,Hannah Löwe: Geschenkpapier - selbstgemacht!,"Selbstgemachtes zum Weihnachtsfest. Hannah Löwe zeigt euch im Tutorial, wie einfach Eltern und Kinder gemeinsam Geschenkpapier basteln können.",,"['familie-und-partnerschaft', 'freizeit-urlaub']",2025-03-05T19:53:43.281926
https://www.elternleben.de/elternwissen/schulkind/familie-und-freizeit/,content/elternleben/elternwissen/schulkind/familie-und-freizeit.md,familie-und-freizeit.md,Dein Schulkind durch die Schulzeit begleiten,"Erfahre, wie du dein Schulkind im Alltag unterstützt. Mit Tipps zu Lernen, Freundschaften und Freizeit.",,"['elternwissen', 'schulkind']",2025-03-05T19:53:45.236840
https://www.elternleben.de/schwangerschaft/babymoon-reisen-in-der-schwangerschaft/,content/elternleben/schwangerschaft/babymoon-reisen-in-der-schwangerschaft.md,babymoon-reisen-in-der-schwangerschaft.md,Reisen in der Schwangerschaft: Tipps & Ideen für euren Babymoon,"Schwanger & Urlaub: Krankenversicherung, Impfungen und Schwangerschaftsvorsorge unterwegs. Wie Reisen in der Schwangerschaft für werdende Eltern möglich ist",,['schwangerschaft'],2025-03-05T19:53:50.411065
https://www.elternleben.de/baby/stillen/clusterfeeding/,content/elternleben/baby/stillen/clusterfeeding.md,clusterfeeding.md,Clusterfeeding: Die 9 wichtigsten Fragen & was du tun kannst,Clusterfeeding kann sehr anstrengend sein! Hier beantworten wir dir die 9 wichtigsten Fragen zum Clusterfeeding und geben dir Tipps!,Melanie Schüer,"['baby', 'stillen']",2025-03-05T19:53:51.386281
https://www.elternleben.de/l/mobbingberatung/,content/elternleben/l/mobbingberatung.md,mobbingberatung.md,Mein Kind wird gemobbt - Mobbingberatung auf Elternleben.de,"Online Mobbingberatung für Eltern. Dein Kind wird gemobbt, und du weißt nicht, wie du ihm helfen kannst? Unsere Experten beraten schnell, professionell und vertraulich.",,['l'],2025-03-05T19:53:51.556793
https://www.elternleben.de/kleinkind/trocken-werden/tipps-trocken-werden-beduerfnisorientiertes-sauberwerden-statt-toepfchen-training/,content/elternleben/kleinkind/trocken-werden/tipps-trocken-werden-beduerfnisorientiertes-sauberwerden-statt-toepfchen-training.md,tipps-trocken-werden-beduerfnisorientiertes-sauberwerden-statt-toepfchen-training.md,Bedürfnisorientiertes Sauberwerden statt Töpfchen-Training,"Das Sauberwerden ist ein weiterer, großer Entwicklungsschritt deines Kindes. Die Neugier zeigen Kinder meist zwischen dem 18. und 36. Lebensmonat.",Sandra Lößl,"['kleinkind', 'trocken-werden']",2025-03-05T19:53:53.298318
https://www.elternleben.de/familie-und-partnerschaft/elternvergleiche/,content/elternleben/familie-und-partnerschaft/elternvergleiche.md,elternvergleiche.md,Erfahrungsbericht: Elternvergleiche,Elternvergleiche: Konkurrenz zwischen Müttern oder Vätern - wie du damit umgehst & warum einander unterstützen wichtig ist. Ein Erfahrungsbericht,Andrea Zschocher,['familie-und-partnerschaft'],2025-03-05T19:53:54.051460
https://www.elternleben.de/elternwissen/schulkind/,content/elternleben/elternwissen/schulkind.md,schulkind.md,Schulkind,,,['elternwissen'],2025-03-05T19:53:54.211274
https://www.elternleben.de/erziehung-und-foerderung/selbstvertrauen-bei-kindern-staerken/,content/elternleben/erziehung-und-foerderung/selbstvertrauen-bei-kindern-staerken.md,selbstvertrauen-bei-kindern-staerken.md,Selbstbewusstsein bei Kindern stärken: 11 Übungen & Tipps,Du möchtest das Selbstbewusstsein & Selbstwertgefühl deines Kindes stärken? Wir zeigen dir 11 Übungen für selbstbewusstere Kinder.,Malena Böse,['erziehung-und-foerderung'],2025-03-05T19:53:56.095866
https://www.elternleben.de/baby/hannah-loewe-muetter-wissen-alles/,content/elternleben/baby/hannah-loewe-muetter-wissen-alles.md,hannah-loewe-muetter-wissen-alles.md,Hannah Löwe: Mütter wissen alles?!,"Wissen Mütter alles? Wenn es um’s Baby geht, soll Mama immer wissen, warum es weint und was es braucht. Hannah Löwe im Vlog über Fragezeichen von Müttern.",,['baby'],2025-03-05T19:53:57.110791
https://www.elternleben.de/erziehung-und-foerderung/hochbegabung-bei-kindern/emotionale-sensibilitaet-i-can-methode/,content/elternleben/erziehung-und-foerderung/hochbegabung-bei-kindern/emotionale-sensibilitaet-i-can-methode.md,emotionale-sensibilitaet-i-can-methode.md,Emotionale Sensibilität: Hilfe durch die I CAN Methode,"I CAN Methode: Praktische Tipps, wie du deinem emotional sensiblen Kind hilfst, Gefühle zu verstehen und seine Sensibilität als Stärke zu nutzen.",Martina Rosenboom,"['erziehung-und-foerderung', 'hochbegabung-bei-kindern']",2025-03-05T19:54:01.607791
https://www.elternleben.de/familie-und-partnerschaft/freizeit-urlaub/indoorspielplatz-toben-auch-bei-miesem-wetter/,content/elternleben/familie-und-partnerschaft/freizeit-urlaub/indoorspielplatz-toben-auch-bei-miesem-wetter.md,indoorspielplatz-toben-auch-bei-miesem-wetter.md,Toben auch bei miesem Wetter - Tipps für den Indoorspielplatz,Mieses Wetter ergibt Langeweile und schlechte Laune? Auf keinen Fall! Hier finden Eltern Tipps für das Toben auf Indoorspielplätzen.,,"['familie-und-partnerschaft', 'freizeit-urlaub']",2025-03-05T19:54:01.778045
https://www.elternleben.de/erziehung-und-foerderung/neurodiversitaet-bei-kindern/ist-mein-kind-hochsensibel/,content/elternleben/erziehung-und-foerderung/neurodiversitaet-bei-kindern/ist-mein-kind-hochsensibel.md,ist-mein-kind-hochsensibel.md,Hochsensibles Kind? Anzeichen und Tipps für Eltern,"Hochsensibilität bei Kindern erkennen: Woran du merkst, dass dein Kind hochsensibel ist, und wie du es im Alltag unterstützen kannst.",Melanie Schüer,"['erziehung-und-foerderung', 'neurodiversitaet-bei-kindern']",2025-03-05T19:54:02.501606
https://www.elternleben.de/familie-und-partnerschaft/freizeit-urlaub/weihnachten-mit-kindern/,content/elternleben/familie-und-partnerschaft/freizeit-urlaub/weihnachten-mit-kindern.md,weihnachten-mit-kindern.md,Das perfekte Weihnachtsfest?!,"Gibt es das perfekte Weihnachtsfest. Mit einem schönen Tannenbaum, Düfte, Geschenke und lieben Menschen. Eine sehr emotionale Zeit.",Sabine Linz,"['familie-und-partnerschaft', 'freizeit-urlaub']",2025-03-05T19:54:04.343832
https://www.elternleben.de/erziehung-und-foerderung/krisen-und-konflikte/wenn-eltern-wuetend-werden/,content/elternleben/erziehung-und-foerderung/krisen-und-konflikte/wenn-eltern-wuetend-werden.md,wenn-eltern-wuetend-werden.md,Rot sehen: wenn Eltern furchtbar wütend werden,Dürfen Eltern wütend sein? Normale Eltern kämpfen im Alltag durchaus mit Aggressionen: 8 Tipps wie Ihr mit einem Wutanfall am besten umgeht.,,"['erziehung-und-foerderung', 'krisen-und-konflikte']",2025-03-05T19:54:05.655626
https://www.elternleben.de/teenager/pubertaet/pubertaet-bei-maedchen-deine-tochter-wird-ein-teenager/,content/elternleben/teenager/pubertaet/pubertaet-bei-maedchen-deine-tochter-wird-ein-teenager.md,pubertaet-bei-maedchen-deine-tochter-wird-ein-teenager.md,Pubertät bei Mädchen - Deine Tochter wird ein Teenager,Wenn Mädchen Teenager werden. Deine Tochter kommt in die Pubertät: Wie ihr als Eltern mit Veränderungen umgeht und euch vorbereitet lest ihr hier.,,"['teenager', 'pubertaet']",2025-03-05T19:54:08.931280
https://www.elternleben.de/gesundheit-ernaehrung/fieber-und-fieberkrampf-bei-kindern/,content/elternleben/gesundheit-ernaehrung/fieber-und-fieberkrampf-bei-kindern.md,fieber-und-fieberkrampf-bei-kindern.md,Fieber und Fieberkrampf bei Kindern,"Der Fieberkrampf ist für alle Eltern, die ihn das erste Mal erleben, ein erschreckendes Ereignis. Er ist nicht lebensbedrohlich.",Dr. Nikola Klün,['gesundheit-ernaehrung'],2025-03-05T19:54:10.175236
https://www.elternleben.de/baby/entwicklung-baby/baby-dreht-sich/,content/elternleben/baby/entwicklung-baby/baby-dreht-sich.md,baby-dreht-sich.md,Mein Baby dreht sich! Von der Rücken- in die Bauchlage,"Wann und wie beginnen Babys, sich zu drehen? Erfahre mehr über diesen wichtigen Entwicklungsschritt und wie du dein Kind dabei unterstützen kannst.",Sandra Lößl,"['baby', 'entwicklung-baby']",2025-03-05T19:54:11.139165
https://www.elternleben.de/elternwissen/teenager/entwicklung-und-foerderung/,content/elternleben/elternwissen/teenager/entwicklung-und-foerderung.md,entwicklung-und-foerderung.md,Entwicklung und Förderung,,,"['elternwissen', 'teenager']",2025-03-05T19:54:19.047932
https://www.elternleben.de/erziehung-und-foerderung/kommunikation-mit-kindern/streit-vorbeugen-familienkonferenz/,content/elternleben/erziehung-und-foerderung/kommunikation-mit-kindern/streit-vorbeugen-familienkonferenz.md,streit-vorbeugen-familienkonferenz.md,Streit in der Familie vorbeugen – Familienkonferenz,"Bei einer Familienkonferenz verabreden sich Familienmitglieder zu einem gemeinsamen Zeitpunkt. Eine gute Möglichkeit, um Streit in der Familie vorzubeugen.",Nadine Büttner,"['erziehung-und-foerderung', 'kommunikation-mit-kindern']",2025-03-05T19:54:19.208179
https://www.elternleben.de/familie-und-partnerschaft/trennung-mit-kindern/nestmodell/,content/elternleben/familie-und-partnerschaft/trennung-mit-kindern/nestmodell.md,nestmodell.md,Das Nestmodell: Wie es funktioniert und was du beachten musst,"Erfahre, wie das Nestmodell funktioniert und wie du es nach der Trennung umsetzen kannst, um deinen Kindern Stabilität zu bieten.",Melanie Schüer,"['familie-und-partnerschaft', 'trennung-mit-kindern']",2025-03-05T19:54:23.643201
https://www.elternleben.de/schwangerschaft/umstandsmode/,content/elternleben/schwangerschaft/umstandsmode.md,umstandsmode.md,Die 8 wichtigsten Tipps zur Umstandsmode,"Wenn der Babybauch sichtbar wird - Stützstrumpfhosen oder Bauchbänder. Artikel über Umstandsmode, für werdende Mütter. Einkaufen in der Schwangerschaft.",,['schwangerschaft'],2025-03-05T19:54:26.099129
https://www.elternleben.de/kleinkind/kita/eingewoehnung-in-kindergarten/,content/elternleben/kleinkind/kita/eingewoehnung-in-kindergarten.md,eingewoehnung-in-kindergarten.md,"Kita Eingewöhnung: Modelle, Dauer & wie es klappt",Die Eingewöhnung in die Kita beginnt und du fragst dich: Wie lange dauert die Eingewöhnung und wie klappt sie am besten?,Petra Engelsmann,"['kleinkind', 'kita']",2025-03-05T19:54:27.078681
https://www.elternleben.de/erziehung-und-foerderung/krisen-und-konflikte/,content/elternleben/erziehung-und-foerderung/krisen-und-konflikte.md,krisen-und-konflikte.md,Krisen bewältigen und Konflikte lösen,"Entdecke einfühlsame Ansätze, um als Elternteil Krisen mit Zuversicht zu überwinden und Konflikte auf eine respektvolle Weise zu lösen.",,['erziehung-und-foerderung'],2025-03-05T19:54:28.399263
https://www.elternleben.de/elternwissen/schwangerschaft/gesundheit-und-ernaehrung/,content/elternleben/elternwissen/schwangerschaft/gesundheit-und-ernaehrung.md,gesundheit-und-ernaehrung.md,Gesundheit und Ernährung,,,"['elternwissen', 'schwangerschaft']",2025-03-05T19:54:30.868503
https://www.elternleben.de/erziehung-und-foerderung/kommunikation-mit-kindern/gewaltfreie-kommunikation/,content/elternleben/erziehung-und-foerderung/kommunikation-mit-kindern/gewaltfreie-kommunikation.md,gewaltfreie-kommunikation.md,Kathy Weber stellt GFK vor – Gewaltfreie Kommunikation,Kathy Weber stellt euch GFK (Gewaltfreie Kommunikation) nach Marshall B. Rosenberg vor. Kathy ist auf ElternLeben.de Expertin rund um Alltagskonflikte mit Kindern.,Kathy Weber,"['erziehung-und-foerderung', 'kommunikation-mit-kindern']",2025-03-05T19:54:31.037111
https://www.elternleben.de/familie-und-partnerschaft/beruf/mutterschutz/,content/elternleben/familie-und-partnerschaft/beruf/mutterschutz.md,mutterschutz.md,Tipps für die Mutterschutzzeit,Mit dem Mutterschutz beginnen auch die Vorbereitungen auf die Geburt des Babys. Wenn Alltag und Familie geplant werden müssen - Tipps für einen guten Start.,,"['familie-und-partnerschaft', 'beruf']",2025-03-05T19:54:37.578917
https://www.elternleben.de/kleinkind/entwicklung-foerderung/doktorspiele/,content/elternleben/kleinkind/entwicklung-foerderung/doktorspiele.md,doktorspiele.md,Doktorspiele & Co. - wenn Kinder Sexualität entdecken,Wenn Kinder Sexualität entdecken: Doktorspiele und Co Können befremdlich auf Eltern wirken. Alles Teil der natürlichen Entwicklung? Erfahrt hier mehr.,Melanie Schüer,"['kleinkind', 'entwicklung-foerderung']",2025-03-05T19:54:39.000571
https://www.elternleben.de/familie-und-partnerschaft/geschwister/wenn-geschwister-streiten/,content/elternleben/familie-und-partnerschaft/geschwister/wenn-geschwister-streiten.md,wenn-geschwister-streiten.md,Wenn Geschwister streiten …,Streit unter Geschwister-Kindern: Was ihr als Eltern gegen häufige Konflikte zwischen Kindern tun könnt. Tipps für den harmonischen Familien-Alltag.,Melanie Schüer,"['familie-und-partnerschaft', 'geschwister']",2025-03-05T19:54:39.749224
https://www.elternleben.de/baby/bindung/papazeit-von-anfang-an/,content/elternleben/baby/bindung/papazeit-von-anfang-an.md,papazeit-von-anfang-an.md,Papazeit von Anfang an,Papazeit: Trotz Vorurteile ein fürsorglicher Vater von Anfang an – aber wie? Hier findest Du Tipps und Anregungen zu Deiner Vaterrolle,,"['baby', 'bindung']",2025-03-05T19:54:43.280502
https://www.elternleben.de/baby/stillen/hannah-loewe-stillen-oder-nicht/,content/elternleben/baby/stillen/hannah-loewe-stillen-oder-nicht.md,hannah-loewe-stillen-oder-nicht.md,Stilldruck: Muss ich stillen oder nicht?,Müssen Babys gestillt werden? Eltern unter Druck: Stillen als Fundament der Bindung zwischen Mutter und Kind - und wenn's nicht klappt? Hannah Löwe im Vlog,,"['baby', 'stillen']",2025-03-05T19:54:45.476245
https://www.elternleben.de/disclaimer/,content/elternleben/disclaimer.md,disclaimer.md,Disclaimer,,,elternleben,2025-03-05T19:54:45.921206
https://www.elternleben.de/kleinkind/kita/,content/elternleben/kleinkind/kita.md,kita.md,Kita - Alles Wissenswertes über die Kindergarten-Zeit,"Was du über die Kindergarten-Zeit in der Kita wissen solltest: Eingewöhnung, Tagesablauf und die Entwicklung deines Kindes im Fokus.",,['kleinkind'],2025-03-05T19:54:46.094299
https://www.elternleben.de/baby/babysitter/,content/elternleben/baby/babysitter.md,babysitter.md,Den richtigen Babysitter finden,"Wer passt aufs Baby auf, wenn Oma, Opa oder Bekannte keine Zeit haben? Tipps, wie du den richtigen Babysitter findest, erhältst du hier.",,['baby'],2025-03-05T19:54:48.387201
https://www.elternleben.de/haeufige-fragen/trotz-wut/mein-kind-hat-starke-wutanfaelle-wie-soll-ich-reagieren/,content/elternleben/haeufige-fragen/trotz-wut/mein-kind-hat-starke-wutanfaelle-wie-soll-ich-reagieren.md,mein-kind-hat-starke-wutanfaelle-wie-soll-ich-reagieren.md,Wutanfälle bei Kindern: Gründe und wie du reagieren kannst,"Wutanfälle & Wutausbrüche bei Kindern & Kleinkindern können sehr herausfordernd sein. Unsere Expertin zeigt dir, was hilft.",Melanie Schüer,"['haeufige-fragen', 'trotz-wut']",2025-03-05T19:55:00.154437
https://www.elternleben.de/familie-und-partnerschaft/beruf/nach-der-einschulung-durchstarten-im-job/,content/elternleben/familie-und-partnerschaft/beruf/nach-der-einschulung-durchstarten-im-job.md,nach-der-einschulung-durchstarten-im-job.md,Nach der Einschulung durchstarten im Job?,Job nach der Einschulung: Vollzeit oder Teilzeit? Berufstätige Eltern mit Grundschulkindern -  Pro und Contra zum Durchstarten im Beruf.,,"['familie-und-partnerschaft', 'beruf']",2025-03-05T19:55:02.597411
https://www.elternleben.de/baby/erster-geburtstag/,content/elternleben/baby/erster-geburtstag.md,erster-geburtstag.md,Der Erste Geburtstag,"Der erste Geburtstag - ein ganz besonderes Ereignis! Kindergeburtstag: Lest hier, wie Eltern und Kinder gemeinsam feiern und dabei Stress vermeiden",Rose Volz-Schmidt,['baby'],2025-03-05T19:55:03.064320
https://www.elternleben.de/familie-und-partnerschaft/freizeit-urlaub/hannah-loewe-schlafanzugtage-kurzurlaub-zu-haus-zwischen-den-jahren/,content/elternleben/familie-und-partnerschaft/freizeit-urlaub/hannah-loewe-schlafanzugtage-kurzurlaub-zu-haus-zwischen-den-jahren.md,hannah-loewe-schlafanzugtage-kurzurlaub-zu-haus-zwischen-den-jahren.md,Hannah Löwe: Schlafanzugtage – Kurzurlaub zu Haus zwischen den Jahren,Zwischen den Jahren – Kurzurlaub zu Haus. So genießt ihr die freie Zeit als Familie und erholt euch von den Feiertagen. Hannah Löwe im Video-Blog,,"['familie-und-partnerschaft', 'freizeit-urlaub']",2025-03-05T19:55:03.827959
